{
    "$schema": "http://json-schema.org/schema#",
    "properties": {
        "encounter_method_rates": {
            "items": {
                "properties": {
                    "encounter_method": {
                        "properties": {
                            "name": {
                                "type": "string"
                            },
                            "url": {
                                "type": "string"
                            }
                        },
                        "required": [
                            "name",
                            "url"
                        ],
                        "type": "object"
                    },
                    "version_details": {
                        "items": {
                            "properties": {
                                "rate": {
                                    "type": "integer"
                                },
                                "version": {
                                    "properties": {
                                        "name": {
                                            "type": "string"
                                        },
                                        "url": {
                                            "type": "string"
                                        }
                                    },
                                    "required": [
                                        "name",
                                        "url"
                                    ],
                                    "type": "object"
                                }
                            },
                            "required": [
                                "rate",
                                "version"
                            ],
                            "type": "object"
                        },
                        "type": "array"
                    }
                },
                "required": [
                    "encounter_method",
                    "version_details"
                ],
                "type": "object"
            },
            "type": "array"
        },
        "game_index": {
            "type": "integer"
        },
        "id": {
            "type": "integer"
        },
        "location": {
            "properties": {
                "name": {
                    "type": "string"
                },
                "url": {
                    "type": "string"
                }
            },
            "required": [
                "name",
                "url"
            ],
            "type": "object"
        },
        "name": {
            "type": "string"
        },
        "names": {
            "items": {
                "properties": {
                    "language": {
                        "properties": {
                            "name": {
                                "type": "string"
                            },
                            "url": {
                                "type": "string"
                            }
                        },
                        "required": [
                            "name",
                            "url"
                        ],
                        "type": "object"
                    },
                    "name": {
                        "type": "string"
                    }
                },
                "required": [
                    "language",
                    "name"
                ],
                "type": "object"
            },
            "type": "array"
        },
        "pokemon_encounters": {
            "items": {
                "properties": {
                    "pokemon": {
                        "properties": {
                            "name": {
                                "type": "string"
                            },
                            "url": {
                                "type": "string"
                            }
                        },
                        "required": [
                            "name",
                            "url"
                        ],
                        "type": "object"
                    },
                    "version_details": {
                        "items": {
                            "properties": {
                                "encounter_details": {
                                    "items": {
                                        "properties": {
                                            "chance": {
                                                "type": "integer"
                                            },
                                            "condition_values": {
                                                "items": {
                                                    "properties": {
                                                        "name": {
                                                            "type": "string"
                                                        },
                                                        "url": {
                                                            "type": "string"
                                                        }
                                                    },
                                                    "required": [
                                                        "name",
                                                        "url"
                                                    ],
                                                    "type": "object"
                                                },
                                                "type": "array"
                                            },
                                            "max_level": {
                                                "type": "integer"
                                            },
                                            "method": {
                                                "properties": {
                                                    "name": {
                                                        "type": "string"
                                                    },
                                                    "url": {
                                                        "type": "string"
                                                    }
                                                },
                                                "required": [
                                                    "name",
                                                    "url"
                                                ],
                                                "type": "object"
                                            },
                                            "min_level": {
                                                "type": "integer"
                                            }
                                        },
                                        "required": [
                                            "chance",
                                            "condition_values",
                                            "max_level",
                                            "method",
                                            "min_level"
                                        ],
                                        "type": "object"
                                    },
                                    "type": "array"
                                },
                                "max_chance": {
                                    "type": "integer"
                                },
                                "version": {
                                    "properties": {
                                        "name": {
                                            "type": "string"
                                        },
                                        "url": {
                                            "type": "string"
                                        }
                                    },
                                    "required": [
                                        "name",
                                        "url"
                                    ],
                                    "type": "object"
                                }
                            },
                            "required": [
                                "encounter_details",
                                "max_chance",
                                "version"
                            ],
                            "type": "object"
                        },
                        "type": "array"
                    }
                },
                "required": [
                    "pokemon",
                    "version_details"
                ],
                "type": "object"
            },
            "type": "array"
        }
    },
    "required": [
        "encounter_method_rates",
        "game_index",
        "id",
        "location",
        "name",
        "names",
        "pokemon_encounters"
    ],
    "type": "object"
}