{"names":[{"name":"Unknown Area 317","language":{"url":"http:\/\/127.0.0.1:8000\/api\/v2\/language\/9\/","name":"en"}}],"name":"frost-cavern-unknown-area-317","encounter_method_rates":[],"location":{"url":"http:\/\/127.0.0.1:8000\/api\/v2\/location\/640\/","name":"frost-cavern"},"pokemon_encounters":[{"version_details":[{"max_chance":16,"version":{"url":"http:\/\/127.0.0.1:8000\/api\/v2\/version\/23\/","name":"x"},"encounter_details":[{"min_level":38,"max_level":38,"condition_values":[],"chance":10,"method":{"url":"http:\/\/127.0.0.1:8000\/api\/v2\/encounter-method\/1\/","name":"walk"}},{"min_level":39,"max_level":39,"condition_values":[],"chance":5,"method":{"url":"http:\/\/127.0.0.1:8000\/api\/v2\/encounter-method\/1\/","name":"walk"}},{"min_level":40,"max_level":40,"condition_values":[],"chance":1,"method":{"url":"http:\/\/127.0.0.1:8000\/api\/v2\/encounter-method\/1\/","name":"walk"}}]},{"max_chance":16,"version":{"url":"http:\/\/127.0.0.1:8000\/api\/v2\/version\/24\/","name":"y"},"encounter_details":[{"min_level":40,"max_level":40,"condition_values":[],"chance":1,"method":{"url":"http:\/\/127.0.0.1:8000\/api\/v2\/encounter-method\/1\/","name":"walk"}},{"min_level":39,"max_level":39,"condition_values":[],"chance":5,"method":{"url":"http:\/\/127.0.0.1:8000\/api\/v2\/encounter-method\/1\/","name":"walk"}},{"min_level":38,"max_level":38,"condition_values":[],"chance":10,"method":{"url":"http:\/\/127.0.0.1:8000\/api\/v2\/encounter-method\/1\/","name":"walk"}}]}],"pokemon":{"url":"http:\/\/127.0.0.1:8000\/api\/v2\/pokemon\/93\/","name":"haunter"}},{"version_details":[{"max_chance":20,"version":{"url":"http:\/\/127.0.0.1:8000\/api\/v2\/version\/23\/","name":"x"},"encounter_details":[{"min_level":39,"max_level":39,"condition_values":[],"chance":10,"method":{"url":"http:\/\/127.0.0.1:8000\/api\/v2\/encounter-method\/1\/","name":"walk"}},{"min_level":40,"max_level":40,"condition_values":[],"chance":10,"method":{"url":"http:\/\/127.0.0.1:8000\/api\/v2\/encounter-method\/1\/","name":"walk"}}]},{"max_chance":20,"version":{"url":"http:\/\/127.0.0.1:8000\/api\/v2\/version\/24\/","name":"y"},"encounter_details":[{"min_level":40,"max_level":40,"condition_values":[],"chance":10,"method":{"url":"http:\/\/127.0.0.1:8000\/api\/v2\/encounter-method\/1\/","name":"walk"}},{"min_level":39,"max_level":39,"condition_values":[],"chance":10,"method":{"url":"http:\/\/127.0.0.1:8000\/api\/v2\/encounter-method\/1\/","name":"walk"}}]}],"pokemon":{"url":"http:\/\/127.0.0.1:8000\/api\/v2\/pokemon\/124\/","name":"jynx"}},{"version_details":[{"max_chance":20,"version":{"url":"http:\/\/127.0.0.1:8000\/api\/v2\/version\/23\/","name":"x"},"encounter_details":[{"min_level":38,"max_level":38,"condition_values":[],"chance":10,"method":{"url":"http:\/\/127.0.0.1:8000\/api\/v2\/encounter-method\/1\/","name":"walk"}},{"min_level":39,"max_level":39,"condition_values":[],"chance":10,"method":{"url":"http:\/\/127.0.0.1:8000\/api\/v2\/encounter-method\/1\/","name":"walk"}}]},{"max_chance":20,"version":{"url":"http:\/\/127.0.0.1:8000\/api\/v2\/version\/24\/","name":"y"},"encounter_details":[{"min_level":39,"max_level":39,"condition_values":[],"chance":10,"method":{"url":"http:\/\/127.0.0.1:8000\/api\/v2\/encounter-method\/1\/","name":"walk"}},{"min_level":38,"max_level":38,"condition_values":[],"chance":10,"method":{"url":"http:\/\/127.0.0.1:8000\/api\/v2\/encounter-method\/1\/","name":"walk"}}]}],"pokemon":{"url":"http:\/\/127.0.0.1:8000\/api\/v2\/pokemon\/221\/","name":"piloswine"}},{"version_details":[{"max_chance":20,"version":{"url":"http:\/\/127.0.0.1:8000\/api\/v2\/version\/23\/","name":"x"},"encounter_details":[{"min_level":39,"max_level":39,"condition_values":[],"chance":10,"method":{"url":"http:\/\/127.0.0.1:8000\/api\/v2\/encounter-method\/1\/","name":"walk"}},{"min_level":40,"max_level":40,"condition_values":[],"chance":10,"method":{"url":"http:\/\/127.0.0.1:8000\/api\/v2\/encounter-method\/1\/","name":"walk"}}]},{"max_chance":20,"version":{"url":"http:\/\/127.0.0.1:8000\/api\/v2\/version\/24\/","name":"y"},"encounter_details":[{"min_level":40,"max_level":40,"condition_values":[],"chance":10,"method":{"url":"http:\/\/127.0.0.1:8000\/api\/v2\/encounter-method\/1\/","name":"walk"}},{"min_level":39,"max_level":39,"condition_values":[],"chance":10,"method":{"url":"http:\/\/127.0.0.1:8000\/api\/v2\/encounter-method\/1\/","name":"walk"}}]}],"pokemon":{"url":"http:\/\/127.0.0.1:8000\/api\/v2\/pokemon\/614\/","name":"beartic"}},{"version_details":[{"max_chance":4,"version":{"url":"http:\/\/127.0.0.1:8000\/api\/v2\/version\/23\/","name":"x"},"encounter_details":[{"min_level":40,"max_level":40,"condition_values":[],"chance":4,"method":{"url":"http:\/\/127.0.0.1:8000\/api\/v2\/encounter-method\/1\/","name":"walk"}}]},{"max_chance":4,"version":{"url":"http:\/\/127.0.0.1:8000\/api\/v2\/version\/24\/","name":"y"},"encounter_details":[{"min_level":40,"max_level":40,"condition_values":[],"chance":4,"method":{"url":"http:\/\/127.0.0.1:8000\/api\/v2\/encounter-method\/1\/","name":"walk"}}]}],"pokemon":{"url":"http:\/\/127.0.0.1:8000\/api\/v2\/pokemon\/615\/","name":"cryogonal"}},{"version_details":[{"max_chance":20,"version":{"url":"http:\/\/127.0.0.1:8000\/api\/v2\/version\/23\/","name":"x"},"encounter_details":[{"min_level":39,"max_level":39,"condition_values":[],"chance":10,"method":{"url":"http:\/\/127.0.0.1:8000\/api\/v2\/encounter-method\/1\/","name":"walk"}},{"min_level":40,"max_level":40,"condition_values":[],"chance":10,"method":{"url":"http:\/\/127.0.0.1:8000\/api\/v2\/encounter-method\/1\/","name":"walk"}}]},{"max_chance":20,"version":{"url":"http:\/\/127.0.0.1:8000\/api\/v2\/version\/24\/","name":"y"},"encounter_details":[{"min_level":40,"max_level":40,"condition_values":[],"chance":10,"method":{"url":"http:\/\/127.0.0.1:8000\/api\/v2\/encounter-method\/1\/","name":"walk"}},{"min_level":39,"max_level":39,"condition_values":[],"chance":10,"method":{"url":"http:\/\/127.0.0.1:8000\/api\/v2\/encounter-method\/1\/","name":"walk"}}]}],"pokemon":{"url":"http:\/\/127.0.0.1:8000\/api\/v2\/pokemon\/712\/","name":"bergmite"}}],"id":746,"game_index":0}
