{"names":[{"name":"","language":{"url":"http:\/\/127.0.0.1:8000\/api\/v2\/language\/9\/","name":"en"}}],"name":"weepth-chamber-area","encounter_method_rates":[{"encounter_method":{"url":"http:\/\/127.0.0.1:8000\/api\/v2\/encounter-method\/1\/","name":"walk"},"version_details":[{"rate":7,"version":{"url":"http:\/\/127.0.0.1:8000\/api\/v2\/version\/11\/","name":"leafgreen"}},{"rate":7,"version":{"url":"http:\/\/127.0.0.1:8000\/api\/v2\/version\/10\/","name":"firered"}}]}],"location":{"url":"http:\/\/127.0.0.1:8000\/api\/v2\/location\/493\/","name":"weepth-chamber"},"pokemon_encounters":[{"version_details":[{"max_chance":100,"version":{"url":"http:\/\/127.0.0.1:8000\/api\/v2\/version\/10\/","name":"firered"},"encounter_details":[{"min_level":25,"max_level":25,"condition_values":[],"chance":1,"method":{"url":"http:\/\/127.0.0.1:8000\/api\/v2\/encounter-method\/1\/","name":"walk"}},{"min_level":25,"max_level":25,"condition_values":[],"chance":1,"method":{"url":"http:\/\/127.0.0.1:8000\/api\/v2\/encounter-method\/1\/","name":"walk"}},{"min_level":25,"max_level":25,"condition_values":[],"chance":4,"method":{"url":"http:\/\/127.0.0.1:8000\/api\/v2\/encounter-method\/1\/","name":"walk"}},{"min_level":25,"max_level":25,"condition_values":[],"chance":4,"method":{"url":"http:\/\/127.0.0.1:8000\/api\/v2\/encounter-method\/1\/","name":"walk"}},{"min_level":25,"max_level":25,"condition_values":[],"chance":5,"method":{"url":"http:\/\/127.0.0.1:8000\/api\/v2\/encounter-method\/1\/","name":"walk"}},{"min_level":25,"max_level":25,"condition_values":[],"chance":5,"method":{"url":"http:\/\/127.0.0.1:8000\/api\/v2\/encounter-method\/1\/","name":"walk"}},{"min_level":25,"max_level":25,"condition_values":[],"chance":10,"method":{"url":"http:\/\/127.0.0.1:8000\/api\/v2\/encounter-method\/1\/","name":"walk"}},{"min_level":25,"max_level":25,"condition_values":[],"chance":10,"method":{"url":"http:\/\/127.0.0.1:8000\/api\/v2\/encounter-method\/1\/","name":"walk"}},{"min_level":25,"max_level":25,"condition_values":[],"chance":10,"method":{"url":"http:\/\/127.0.0.1:8000\/api\/v2\/encounter-method\/1\/","name":"walk"}},{"min_level":25,"max_level":25,"condition_values":[],"chance":10,"method":{"url":"http:\/\/127.0.0.1:8000\/api\/v2\/encounter-method\/1\/","name":"walk"}},{"min_level":25,"max_level":25,"condition_values":[],"chance":20,"method":{"url":"http:\/\/127.0.0.1:8000\/api\/v2\/encounter-method\/1\/","name":"walk"}},{"min_level":25,"max_level":25,"condition_values":[],"chance":20,"method":{"url":"http:\/\/127.0.0.1:8000\/api\/v2\/encounter-method\/1\/","name":"walk"}}]},{"max_chance":100,"version":{"url":"http:\/\/127.0.0.1:8000\/api\/v2\/version\/11\/","name":"leafgreen"},"encounter_details":[{"min_level":25,"max_level":25,"condition_values":[],"chance":1,"method":{"url":"http:\/\/127.0.0.1:8000\/api\/v2\/encounter-method\/1\/","name":"walk"}},{"min_level":25,"max_level":25,"condition_values":[],"chance":1,"method":{"url":"http:\/\/127.0.0.1:8000\/api\/v2\/encounter-method\/1\/","name":"walk"}},{"min_level":25,"max_level":25,"condition_values":[],"chance":4,"method":{"url":"http:\/\/127.0.0.1:8000\/api\/v2\/encounter-method\/1\/","name":"walk"}},{"min_level":25,"max_level":25,"condition_values":[],"chance":4,"method":{"url":"http:\/\/127.0.0.1:8000\/api\/v2\/encounter-method\/1\/","name":"walk"}},{"min_level":25,"max_level":25,"condition_values":[],"chance":5,"method":{"url":"http:\/\/127.0.0.1:8000\/api\/v2\/encounter-method\/1\/","name":"walk"}},{"min_level":25,"max_level":25,"condition_values":[],"chance":5,"method":{"url":"http:\/\/127.0.0.1:8000\/api\/v2\/encounter-method\/1\/","name":"walk"}},{"min_level":25,"max_level":25,"condition_values":[],"chance":10,"method":{"url":"http:\/\/127.0.0.1:8000\/api\/v2\/encounter-method\/1\/","name":"walk"}},{"min_level":25,"max_level":25,"condition_values":[],"chance":10,"method":{"url":"http:\/\/127.0.0.1:8000\/api\/v2\/encounter-method\/1\/","name":"walk"}},{"min_level":25,"max_level":25,"condition_values":[],"chance":10,"method":{"url":"http:\/\/127.0.0.1:8000\/api\/v2\/encounter-method\/1\/","name":"walk"}},{"min_level":25,"max_level":25,"condition_values":[],"chance":10,"method":{"url":"http:\/\/127.0.0.1:8000\/api\/v2\/encounter-method\/1\/","name":"walk"}},{"min_level":25,"max_level":25,"condition_values":[],"chance":20,"method":{"url":"http:\/\/127.0.0.1:8000\/api\/v2\/encounter-method\/1\/","name":"walk"}},{"min_level":25,"max_level":25,"condition_values":[],"chance":20,"method":{"url":"http:\/\/127.0.0.1:8000\/api\/v2\/encounter-method\/1\/","name":"walk"}}]}],"pokemon":{"url":"http:\/\/127.0.0.1:8000\/api\/v2\/pokemon\/201\/","name":"unown"}}],"id":452,"game_index":2}
