{
    "encounter_method_rates": [
        {
            "encounter_method": {
                "name": "walk",
                "url": "http://127.0.0.1:8000/api/v2/encounter-method/1/"
            },
            "version_details": [
                {
                    "rate": 7,
                    "version": {
                        "name": "emerald",
                        "url": "http://127.0.0.1:8000/api/v2/version/9/"
                    }
                }
            ]
        }
    ],
    "game_index": 117,
    "id": 444,
    "location": {
        "name": "hoenn-altering-cave",
        "url": "http://127.0.0.1:8000/api/v2/location/490/"
    },
    "name": "hoenn-altering-cave-d",
    "names": [
        {
            "language": {
                "name": "en",
                "url": "http://127.0.0.1:8000/api/v2/language/9/"
            },
            "name": "d"
        }
    ],
    "pokemon_encounters": [
        {
            "pokemon": {
                "name": "houndour",
                "url": "http://127.0.0.1:8000/api/v2/pokemon/228/"
            },
            "version_details": [
                {
                    "encounter_details": [
                        {
                            "chance": 20,
                            "condition_values": [],
                            "max_level": 16,
                            "method": {
                                "name": "walk",
                                "url": "http://127.0.0.1:8000/api/v2/encounter-method/1/"
                            },
                            "min_level": 16
                        },
                        {
                            "chance": 20,
                            "condition_values": [],
                            "max_level": 18,
                            "method": {
                                "name": "walk",
                                "url": "http://127.0.0.1:8000/api/v2/encounter-method/1/"
                            },
                            "min_level": 18
                        },
                        {
                            "chance": 10,
                            "condition_values": [],
                            "max_level": 14,
                            "method": {
                                "name": "walk",
                                "url": "http://127.0.0.1:8000/api/v2/encounter-method/1/"
                            },
                            "min_level": 14
                        },
                        {
                            "chance": 10,
                            "condition_values": [],
                            "max_level": 20,
                            "method": {
                                "name": "walk",
                                "url": "http://127.0.0.1:8000/api/v2/encounter-method/1/"
                            },
                            "min_level": 20
                        },
                        {
                            "chance": 10,
                            "condition_values": [],
                            "max_level": 16,
                            "method": {
                                "name": "walk",
                                "url": "http://127.0.0.1:8000/api/v2/encounter-method/1/"
                            },
                            "min_level": 16
                        },
                        {
                            "chance": 10,
                            "condition_values": [],
                            "max_level": 18,
                            "method": {
                                "name": "walk",
                                "url": "http://127.0.0.1:8000/api/v2/encounter-method/1/"
                            },
                            "min_level": 18
                        },
                        {
                            "chance": 5,
                            "condition_values": [],
                            "max_level": 22,
                            "method": {
                                "name": "walk",
                                "url": "http://127.0.0.1:8000/api/v2/encounter-method/1/"
                            },
                            "min_level": 22
                        },
                        {
                            "chance": 5,
                            "condition_values": [],
                            "max_level": 12,
                            "method": {
                                "name": "walk",
                                "url": "http://127.0.0.1:8000/api/v2/encounter-method/1/"
                            },
                            "min_level": 12
                        },
                        {
                            "chance": 4,
                            "condition_values": [],
                            "max_level": 14,
                            "method": {
                                "name": "walk",
                                "url": "http://127.0.0.1:8000/api/v2/encounter-method/1/"
                            },
                            "min_level": 14
                        },
                        {
                            "chance": 4,
                            "condition_values": [],
                            "max_level": 20,
                            "method": {
                                "name": "walk",
                                "url": "http://127.0.0.1:8000/api/v2/encounter-method/1/"
                            },
                            "min_level": 20
                        },
                        {
                            "chance": 1,
                            "condition_values": [],
                            "max_level": 14,
                            "method": {
                                "name": "walk",
                                "url": "http://127.0.0.1:8000/api/v2/encounter-method/1/"
                            },
                            "min_level": 14
                        },
                        {
                            "chance": 1,
                            "condition_values": [],
                            "max_level": 20,
                            "method": {
                                "name": "walk",
                                "url": "http://127.0.0.1:8000/api/v2/encounter-method/1/"
                            },
                            "min_level": 20
                        }
                    ],
                    "max_chance": 100,
                    "version": {
                        "name": "emerald",
                        "url": "http://127.0.0.1:8000/api/v2/version/9/"
                    }
                }
            ]
        }
    ]
}
