{"names":[{"name":"room 7","language":{"url":"http:\/\/127.0.0.1:8000\/api\/v2\/language\/9\/","name":"en"}}],"name":"lost-cave-room-7","encounter_method_rates":[{"encounter_method":{"url":"http:\/\/127.0.0.1:8000\/api\/v2\/encounter-method\/1\/","name":"walk"},"version_details":[{"rate":7,"version":{"url":"http:\/\/127.0.0.1:8000\/api\/v2\/version\/11\/","name":"leafgreen"}},{"rate":7,"version":{"url":"http:\/\/127.0.0.1:8000\/api\/v2\/version\/10\/","name":"firered"}}]}],"location":{"url":"http:\/\/127.0.0.1:8000\/api\/v2\/location\/504\/","name":"lost-cave"},"pokemon_encounters":[{"version_details":[{"max_chance":20,"version":{"url":"http:\/\/127.0.0.1:8000\/api\/v2\/version\/10\/","name":"firered"},"encounter_details":[{"min_level":37,"max_level":37,"condition_values":[],"chance":20,"method":{"url":"http:\/\/127.0.0.1:8000\/api\/v2\/encounter-method\/1\/","name":"walk"}}]},{"max_chance":20,"version":{"url":"http:\/\/127.0.0.1:8000\/api\/v2\/version\/11\/","name":"leafgreen"},"encounter_details":[{"min_level":37,"max_level":37,"condition_values":[],"chance":20,"method":{"url":"http:\/\/127.0.0.1:8000\/api\/v2\/encounter-method\/1\/","name":"walk"}}]}],"pokemon":{"url":"http:\/\/127.0.0.1:8000\/api\/v2\/pokemon\/41\/","name":"zubat"}},{"version_details":[{"max_chance":20,"version":{"url":"http:\/\/127.0.0.1:8000\/api\/v2\/version\/10\/","name":"firered"},"encounter_details":[{"min_level":43,"max_level":43,"condition_values":[],"chance":10,"method":{"url":"http:\/\/127.0.0.1:8000\/api\/v2\/encounter-method\/1\/","name":"walk"}},{"min_level":41,"max_level":41,"condition_values":[],"chance":10,"method":{"url":"http:\/\/127.0.0.1:8000\/api\/v2\/encounter-method\/1\/","name":"walk"}}]},{"max_chance":20,"version":{"url":"http:\/\/127.0.0.1:8000\/api\/v2\/version\/11\/","name":"leafgreen"},"encounter_details":[{"min_level":43,"max_level":43,"condition_values":[],"chance":10,"method":{"url":"http:\/\/127.0.0.1:8000\/api\/v2\/encounter-method\/1\/","name":"walk"}},{"min_level":41,"max_level":41,"condition_values":[],"chance":10,"method":{"url":"http:\/\/127.0.0.1:8000\/api\/v2\/encounter-method\/1\/","name":"walk"}}]}],"pokemon":{"url":"http:\/\/127.0.0.1:8000\/api\/v2\/pokemon\/42\/","name":"golbat"}},{"version_details":[{"max_chance":25,"version":{"url":"http:\/\/127.0.0.1:8000\/api\/v2\/version\/10\/","name":"firered"},"encounter_details":[{"min_level":38,"max_level":38,"condition_values":[],"chance":5,"method":{"url":"http:\/\/127.0.0.1:8000\/api\/v2\/encounter-method\/1\/","name":"walk"}},{"min_level":40,"max_level":40,"condition_values":[],"chance":20,"method":{"url":"http:\/\/127.0.0.1:8000\/api\/v2\/encounter-method\/1\/","name":"walk"}}]},{"max_chance":25,"version":{"url":"http:\/\/127.0.0.1:8000\/api\/v2\/version\/11\/","name":"leafgreen"},"encounter_details":[{"min_level":38,"max_level":38,"condition_values":[],"chance":5,"method":{"url":"http:\/\/127.0.0.1:8000\/api\/v2\/encounter-method\/1\/","name":"walk"}},{"min_level":40,"max_level":40,"condition_values":[],"chance":20,"method":{"url":"http:\/\/127.0.0.1:8000\/api\/v2\/encounter-method\/1\/","name":"walk"}}]}],"pokemon":{"url":"http:\/\/127.0.0.1:8000\/api\/v2\/pokemon\/92\/","name":"gastly"}},{"version_details":[{"max_chance":30,"version":{"url":"http:\/\/127.0.0.1:8000\/api\/v2\/version\/10\/","name":"firered"},"encounter_details":[{"min_level":44,"max_level":44,"condition_values":[],"chance":10,"method":{"url":"http:\/\/127.0.0.1:8000\/api\/v2\/encounter-method\/1\/","name":"walk"}},{"min_level":46,"max_level":46,"condition_values":[],"chance":10,"method":{"url":"http:\/\/127.0.0.1:8000\/api\/v2\/encounter-method\/1\/","name":"walk"}},{"min_level":48,"max_level":48,"condition_values":[],"chance":5,"method":{"url":"http:\/\/127.0.0.1:8000\/api\/v2\/encounter-method\/1\/","name":"walk"}},{"min_level":50,"max_level":50,"condition_values":[],"chance":4,"method":{"url":"http:\/\/127.0.0.1:8000\/api\/v2\/encounter-method\/1\/","name":"walk"}},{"min_level":52,"max_level":52,"condition_values":[],"chance":1,"method":{"url":"http:\/\/127.0.0.1:8000\/api\/v2\/encounter-method\/1\/","name":"walk"}}]},{"max_chance":30,"version":{"url":"http:\/\/127.0.0.1:8000\/api\/v2\/version\/11\/","name":"leafgreen"},"encounter_details":[{"min_level":44,"max_level":44,"condition_values":[],"chance":10,"method":{"url":"http:\/\/127.0.0.1:8000\/api\/v2\/encounter-method\/1\/","name":"walk"}},{"min_level":46,"max_level":46,"condition_values":[],"chance":10,"method":{"url":"http:\/\/127.0.0.1:8000\/api\/v2\/encounter-method\/1\/","name":"walk"}},{"min_level":48,"max_level":48,"condition_values":[],"chance":5,"method":{"url":"http:\/\/127.0.0.1:8000\/api\/v2\/encounter-method\/1\/","name":"walk"}},{"min_level":50,"max_level":50,"condition_values":[],"chance":4,"method":{"url":"http:\/\/127.0.0.1:8000\/api\/v2\/encounter-method\/1\/","name":"walk"}},{"min_level":52,"max_level":52,"condition_values":[],"chance":1,"method":{"url":"http:\/\/127.0.0.1:8000\/api\/v2\/encounter-method\/1\/","name":"walk"}}]}],"pokemon":{"url":"http:\/\/127.0.0.1:8000\/api\/v2\/pokemon\/93\/","name":"haunter"}},{"version_details":[{"max_chance":5,"version":{"url":"http:\/\/127.0.0.1:8000\/api\/v2\/version\/10\/","name":"firered"},"encounter_details":[{"min_level":22,"max_level":22,"condition_values":[],"chance":4,"method":{"url":"http:\/\/127.0.0.1:8000\/api\/v2\/encounter-method\/1\/","name":"walk"}},{"min_level":22,"max_level":22,"condition_values":[],"chance":1,"method":{"url":"http:\/\/127.0.0.1:8000\/api\/v2\/encounter-method\/1\/","name":"walk"}}]}],"pokemon":{"url":"http:\/\/127.0.0.1:8000\/api\/v2\/pokemon\/198\/","name":"murkrow"}},{"version_details":[{"max_chance":5,"version":{"url":"http:\/\/127.0.0.1:8000\/api\/v2\/version\/11\/","name":"leafgreen"},"encounter_details":[{"min_level":22,"max_level":22,"condition_values":[],"chance":4,"method":{"url":"http:\/\/127.0.0.1:8000\/api\/v2\/encounter-method\/1\/","name":"walk"}},{"min_level":22,"max_level":22,"condition_values":[],"chance":1,"method":{"url":"http:\/\/127.0.0.1:8000\/api\/v2\/encounter-method\/1\/","name":"walk"}}]}],"pokemon":{"url":"http:\/\/127.0.0.1:8000\/api\/v2\/pokemon\/200\/","name":"misdreavus"}}],"id":507,"game_index":62}
